{
  "$schema": "../../../schemas/sprite.schema.json",
  "id": "player_diver",
  "w": 20,
  "h": 29,
  "palette": {
    "K": "#226699",
    "B": "#0044aa",
    "b": "#002187",
    "M": "#003377",
    "G": "#88ccff",
    "L": "#0055cc",
    "l": "#0032a9",
    "O": "#0a0a12"
  },
  "frames": {
    "idle": [
      "....................",
      "....................",
      "....................",
      "....................",
      "............OOOOO...",
      "...........OMMMMMO..",
      "..........OMMMMMMMO.",
      ".........OMMMMMGGGMO",
      ".........OMMMMGGGGGO",
      ".........OMMMMGGGGGO",
      ".........OMMMMMGGGMO",
      "..OOOOOOObBMMMMMMMO.",
      ".OKKKKKKObBBMMMMMO..",
      ".OKKKKKKbbBBBBBBBO..",
      ".OKKKKKKbbBBBBBBO...",
      ".OKKKKKbbbBBBBBBO...",
      ".OKKKKbbbbBBBBBO....",
      ".OKKKKbbbbBBBBBO....",
      ".OKKKbbbbbBBBBO.....",
      ".OKKbbbbbbBBBO......",
      ".OKKbbbbbbBBBO......",
      ".OKbbbbbbbBBO.......",
      "..ObbbbbbbBLO.......",
      ".ObbbbbbbbBLLO......",
      ".ObbbbbbbbLLLO......",
      "..ObbbbbbbLLLO......",
      "..ObbbbbblLLLLO.....",
      "...OObblllLLLLO.....",
      ".....OOllllLLLLO...."
    ],
    "run_a": [
      "....................",
      "....................",
      "....................",
      "....................",
      "............OOOOO...",
      "...........OMMMMMO..",
      "..........OMMMMMMMO.",
      ".........OMMMMMGGGMO",
      ".........OMMMMGGGGGO",
      ".........OMMMMGGGGGO",
      ".........OMMMMMGGGMO",
      "..OOOOOOObBMMMMMMMO.",
      ".OKKKKKKObBBMMMMMO..",
      ".OKKKKKKbbBBBBBBBO..",
      ".OKKKKKKbbBBBBBBO...",
      ".OKKKKKbbbBBBBBBO...",
      ".OKKKKbbbbBBBBBO....",
      ".OKKKKbbbbBBBBBO....",
      ".OKKKbbbbbBBBBO.....",
      ".OKKbbbbbbBBBO......",
      ".OKKbbbbbbBBBO......",
      ".OKbbbbbbbBBO.......",
      "..ObbbbbbbBLO.......",
      ".ObbbbbbbbBLLO......",
      ".ObbbbbbbbLLLO......",
      "..ObbbbbbbLLLO......",
      ".OObbbbbbOLLLLO.....",
      "OllllbblOOLLLLO.....",
      "OllllllO..OLLLLO...."
    ],
    "run_b": [
      "....................",
      "....................",
      "....................",
      "....................",
      "............OOOOO...",
      "...........OMMMMMO..",
      "..........OMMMMMMMO.",
      ".........OMMMMMGGGMO",
      ".........OMMMMGGGGGO",
      ".........OMMMMGGGGGO",
      ".........OMMMMMGGGMO",
      "..OOOOOOObBMMMMMMMO.",
      ".OKKKKKKObBBMMMMMO..",
      ".OKKKKKKbbBBBBBBBO..",
      ".OKKKKKKbbBBBBBBO...",
      ".OKKKKKbbbBBBBBBO...",
      ".OKKKKbbbbBBBBBO....",
      ".OKKKKbbbbBBBBBO....",
      ".OKKKbbbbbBBBBO.....",
      ".OKKbbbbbbBBBO......",
      ".OKKbbbbbbBBBO......",
      ".OKbbbbbbbBBO.......",
      "..ObbbbbbbBLO.......",
      ".ObbbbbbbbBLLO......",
      ".ObbbbbbbbLLLO......",
      "..ObbbbbbbLLO.......",
      "..ObbbbbblLLO.......",
      "...OObblllLLO.......",
      "....OLLllllO........"
    ],
    "jump": [
      "....................",
      "....................",
      "....................",
      "....................",
      "............OOOOO...",
      "...........OMMMMMO..",
      "..........OMMMMMMMO.",
      ".........OMMMMMGGGMO",
      ".........OMMMMGGGGGO",
      ".........OMMMMGGGGGO",
      ".........OMMMMMGGGMO",
      "..OOOOOOObBMMMMMMMO.",
      ".OKKKKKKObBBMMMMMO..",
      ".OKKKKKKbbBBBBBBBO..",
      ".OKKKKKKbbBBBBBBO...",
      ".OKKKKKbbbBBBBBBO...",
      ".OKKKKbbbbBBBBBO....",
      ".OKKKKbbbbBBBBBO....",
      ".OKKKbbbbbBBBBO.....",
      ".OKKbbbbbbBBBO......",
      ".OKKbbbbbbBBBO......",
      ".OKbbbbbbbBBO.......",
      "..ObbbbbbbBO........",
      ".ObbbbbbbbBLO.......",
      ".ObbbbbbbbLLLO......",
      "..ObbbbbbbLLLO......",
      "..ObbbbbbOLLO.......",
      "...OObbOO.OO........",
      ".....OO............."
    ]
  }
}
