{
  "$schema": "../../../schemas/sprite.schema.json",
  "id": "battle_iron_sentinel",
  "w": 34,
  "h": 34,
  "palette": {
    "O": "#0d0e16",
    "A": "#5a7a9e",
    "a": "#8fb0d4",
    "n": "#3d5a78",
    "D": "#243848",
    "E": "#4affea",
    "e": "#b0fff0",
    "S": "#8ecdd9",
    "s": "#c9f0f5",
    "M": "#e2e7f2",
    "m": "#9aa2b8",
    "B": "#7b2f2f",
    "b": "#a34242"
  },
  "frames": {
    "idle": [
      "..........OOOOOOOOOO..............",
      "........OOaaaaaaaaaaOO............",
      ".......OaaaaaaaaaaaaaaO...........",
      "......OaaaaaaaaaaaaaaaaO..........",
      "......OaaAAAAAAAAAAAAaaO..........",
      "......OaAAAAAAAAAAAAAAaO.....OMO..",
      "......OaAADDDDDDDDDDAAaO....OMMMO.",
      "......OaADDDDDDDDDDDDAaO....OMMMO.",
      "......OaADEEDDDDDDEEDAaO....OMMMO.",
      "......OaADEEDDDDDDEEDAaO....OMMMO.",
      "......OaADDDDDDDDDDDDAaO....OMMMO.",
      "......OaAADDDDDDDDDDAAaO....OMMMO.",
      "......OaaAAAAAAAAAAAAaaO....OMMMO.",
      ".......OaaAAAAAAAAAAaaO.....OMMMO.",
      "........OaaaAAAAAAaaaO......OMMMO.",
      ".....OOOOOaaaaaaaaaaOOOOOO..OMMMO.",
      "...OOBbbBOAAAAAAAAAAOAAAAOOOOSSSO.",
      "..OBbbbbBOAnnAAAAnnAOAAAAAOOOSSSO.",
      "..OBbBBbBOAnnAAAAnnAOAAAAAAO.OSO..",
      "..OBbbbbBOAAAAAAAAAAOAAAAAO..OSO..",
      "..OBBbbBBOAAAAAAAAAAOAAAAO...OSO..",
      "...OBBBBOOAAAAAAAAAAOOAAAO........",
      "....OOOO..ADDDDDDDDDA.OOOO........",
      "..........ODDDDDDDDDO.............",
      "..........ODDDDDDDDDO.............",
      "..........OAAAAAAAAAO.............",
      ".........OAAAAAAAAAAAO............",
      ".........OAAAOOOOOAAAO............",
      "........OAAAAO...OAAAAO...........",
      "........OAAAAO...OAAAAO...........",
      ".......OnnnnnO...OnnnnnO..........",
      ".......OnnnnnO...OnnnnnO..........",
      "......OAAAAAAAO.OAAAAAAAO.........",
      "......OOOOOOOOO.OOOOOOOOO........."
    ],
    "attack": [
      "...............OO...........MMM...",
      "..........OOOOOOOO........MMMM....",
      "........OOaaaaaaaaOO....MMMM......",
      ".......OaaaaaaaaaaaaO.MMMM........",
      "......OaaAAAAAAAAAAaMMMM..........",
      "......OaAAAAAAAAAAAMMMM...........",
      "......OaAADDDDDDDDMMMMO...........",
      "......OaADEEDDDDEEMMMAO...........",
      "......OaADEEDDDDEMMMAaO...........",
      "......OaADDDDDDDMMMDAaO...........",
      "......OaAADDDDDMMMDAAaO...........",
      "......OaaAAAAASSSAAAaaO...........",
      ".......OaaAAAASSSAAaaO............",
      "........OaaaAASSSAaaO.............",
      ".....OOOOOaaaaSOaaOOOOO...........",
      "...OOBbbBOAAAAAAAAAAOAAAAOO.......",
      "..OBbbbbBOAnnAAAAnnAOAAAAAO.......",
      "..OBbBBbBOAnnAAAAnnAOAAAAAAO......",
      "..OBbbbbBOAAAAAAAAAAOAAAAAAO......",
      "..OBBbbBBOAAAAAAAAAAOAAAAAO.......",
      "...OBBBBOOAAAAAAAAAAOOAAAO........",
      "....OOOO..ADDDDDDDDDA.OOO.........",
      "..........ODDDDDDDDDO.............",
      "..........ODDDDDDDDDO.............",
      "..........OAAAAAAAAAO.............",
      ".........OAAAAAAAAAAAO............",
      "........OOAAAOOOOOAAAOO...........",
      ".......OAAAAO.....OAAAAO..........",
      "......OAAAAO.......OAAAAO.........",
      "......OnnnnO........OnnnnO........",
      ".....OnnnnnO........OnnnnnO.......",
      ".....OAAAAAAO......OAAAAAAO.......",
      "....OAAAAAAAO......OAAAAAAAO......",
      "....OOOOOOOOO......OOOOOOOOO......"
    ]
  }
}
