{
  "$schema": "../../../schemas/sprite.schema.json",
  "id": "battle_slime_frost",
  "w": 32,
  "h": 26,
  "palette": {
    "O": "#0d1a20",
    "S": "#5f8fd9",
    "s": "#a8c8f5",
    "t": "#e0f0ff",
    "D": "#3a5f99",
    "C": "#f2f8ff",
    "R": "#123044",
    "W": "#ffffff"
  },
  "frames": {
    "idle": [
      "...........OOOOOOOO.............",
      ".........OOtttttttttOO..........",
      "........OttttWWttttttttO........",
      "......OOttttWWWWtttttttttOO.....",
      ".....OstttttWWWWttttttttttsO....",
      "....OssttttttWWtttttttttttssO...",
      "...OsssttttttttttttttttttsssO...",
      "...OSssssttttttttttttttsssssSO..",
      "..OSSssssssttttttttttssssssSSO..",
      "..OSSSssssssssttttssssssssSSSO..",
      "..OSSSSssRRsssssssssRRssssSSSO..",
      "..OSSSSsRRRRsssssssRRRRsSSSSSO..",
      "..OSSSSsRRRRsssssssRRRRsSSSSSO..",
      "..OSSSSssRRsssssssssRRssssSSSO..",
      "..OSSSSSssssssssssssssssSSSSSO..",
      "..OSSSSSsssssCCCCCCsssssSSSSSO..",
      "..OSSSSSSssCCCCCCCCCCssSSSSSSO..",
      "..OSSSSSSSsCCCCCCCCCCsSSSSSSSO..",
      "..OSSSSSSSSsCCCCCCCCsSSSSSSSSO..",
      "..OSSSSSSSSSssCCCCssSSSSSSSSSO..",
      "..ODSSSSSSSSSSssssSSSSSSSSSSDO..",
      "..ODDSSSSSSSSSSSSSSSSSSSSSSDDO..",
      "...ODDSSSSSSSSSSSSSSSSSSSSDDO...",
      "....ODDDSSSSSSSSSSSSSSSSDDDO....",
      ".....OODDDDDDDDDDDDDDDDDDOO.....",
      "........OOOOOOOOOOOOOOOO........"
    ],
    "attack": [
      "..............OOOO..............",
      "...........OOttttttOO...........",
      ".........OOttttWWWtttttOO.......",
      "........OtttttWWWWttttttttO.....",
      ".......OstttttWWWWtttttttttO....",
      "......OssttttttWWttttttttttsO...",
      "......OsssttttttttttttttttssO...",
      ".....OSssssttttttttttttssssSO...",
      ".....OSSssssssttttttssssssSSO...",
      "....OSSSssssssssttssssssssSSSO..",
      "...OSSSSsRRRRssssssRRRRsssSSSO..",
      "...OSSSSRRRRRRsssRRRRRRRsSSSSO..",
      "..OSSSSSRRRRRRsssRRRRRRRSSSSSO..",
      "..OSSSSSsRRRRssssssRRRRssSSSSO..",
      "..OSSSSSssssssssssssssssSSSSSO..",
      "..OSSSSCCCCCCCCCCCCCCCCCCSSSSO..",
      "..OSSSCCOCOCOCOCOCOCOCOCCCSSSO..",
      "..OSSSCCCCCCCCCCCCCCCCCCCCSSSO..",
      ".OSSSSSSCCCCCCCCCCCCCCCCSSSSSSO.",
      ".OSSSSSSSSCCCCCCCCCCCCSSSSSSSSO.",
      "OSSSSSSSSSSSCCCCCCCCSSSSSSSSSSSO",
      "ODSSSSSSSSSSSSSSSSSSSSSSSSSSSSDO",
      "ODDSSSSSSSSSSSSSSSSSSSSSSSSSSDDO",
      ".ODDDSSSSSSSSSSSSSSSSSSSSSSDDDO.",
      "..OODDDDDDDDDDDDDDDDDDDDDDDDOO..",
      "....OOOOOOOOOOOOOOOOOOOOOOOO...."
    ]
  }
}
