{
  "$schema": "../../../schemas/sprite.schema.json",
  "id": "battle_bat_elder",
  "w": 38,
  "h": 26,
  "palette": {
    "O": "#0d0b14",
    "P": "#cdb8e0",
    "p": "#a488c4",
    "q": "#6e5288",
    "B": "#382650",
    "b": "#523460",
    "D": "#2e2740",
    "R": "#e8563f",
    "r": "#ffb0a0",
    "W": "#fffbe8"
  },
  "frames": {
    "idle": [
      "......................................",
      "..OOO.............................OOO.",
      ".OPPPO...........................OPPPO",
      "OPPPPPO.........OOOOOO..........OPPPPO",
      "OPPPPPPO......OOBBBBBBOO.......OPPPPPO",
      "OPpPPPPPO....OBBBBBBBBBBO.....OPPPPPPO",
      "OPpqPPPPPO..OBBBbbbbbbBBBO...OPPPPPPPO",
      "OPpqqPPPPPO.OBBbbbbbbbbBBO..OPPPqqpPPO",
      ".OPqqqPPPPPOBBbRRbbbbRRbBBOOPPPqqqpPO.",
      "..OPqqqPPPPOBBbRRbbbbRRbBBOPPPqqqpPO..",
      "...OPqqqPPPOBBbbbbbbbbbbBBOPPqqqpPO...",
      "....OPqqqPPOBBbbWWWWWWbbBBOPqqqpPO....",
      ".....OPqqqPOBBbbWOWOWObbBBOPqqpPO.....",
      "......OPqqPOOBBbbWWWWbbBBOOPqpPO......",
      ".......OPqPO.OBBbbbbbbBBO.OPpPO.......",
      "........OPO...OBBBbbBBBO...OPO........",
      ".........O.....OBBBBBBO.....O.........",
      "................OBBBBO................",
      "................OBBBBO................",
      ".................OBBO.................",
      "................OBBBBO................",
      "...............OBBOOBBO...............",
      "..............OBBO..OBBO..............",
      "..............OBO....OBO..............",
      "..............OO......OO..............",
      "......................................"
    ],
    "attack": [
      "OOO................................OOO",
      "OPPO..............................OPPO",
      "OPPPO....OOOOOOOOOOOOOOOO........OPPPO",
      "OPPPPO..OOBBBBBBBBBBBBBBOO......OPPPPO",
      "OPPPPPOOBBBBbbbbbbbbbbBBBBO....OPPPPPO",
      "OPpPPPPOBBBbbbbbbbbbbbbbBBBO..OPPPPPPO",
      "OPpqPPPPOBBbbRRRbbbbRRRbbBBO.OPPPqqpPO",
      "OPpqqPPPPOBbbRRRRbbRRRRbbBBOOPPPqqqpPO",
      "OPqqqPPPPOBbbRRRRbbRRRRbbBBOPPPqqqqpPO",
      "OPqqqqPPPOBbbbbbbbbbbbbbbBBOPPqqqqqpPO",
      "OPqqqqqPPOBbbWWWWWWWWWWbbBBOPqqqqqqpPO",
      "OPqqqqqqPOBbbWOWOWOWOWObbBBOPqqqqqqpPO",
      ".OPqqqqqPOBbbWOWOWOWOWObbBBOPqqqqqpPO.",
      "..OPqqqqPOBbbbWWWWWWWWbbbBOOPqqqqpPO..",
      "...OPqqqPOOBbbbbbbbbbbbbBOO.OPqqqpPO..",
      "....OPqqPO.OBBbbbbbbbbBBO...OPqqpPO...",
      ".....OPqPO..OBBBbbbbBBBO.....OPqpPO...",
      "......OPO....OBBBBBBBBO.......OPO.....",
      ".......O......OBBBBBBO.........O......",
      "...............OBBBBO.................",
      "...............OBBBBO.................",
      "..............OBBOOBBO................",
      ".............OBBO..OBBO...............",
      ".............OBO....OBO...............",
      ".............OO......OO...............",
      "......................................"
    ]
  }
}
