{
  "$schema": "../../../schemas/sprite.schema.json",
  "id": "player_explorer",
  "w": 20,
  "h": 29,
  "palette": {
    "F": "#2a1800",
    "Y": "#ffcc00",
    "X": "#fff2c0",
    "B": "#3a2200",
    "b": "#260e00",
    "K": "#554400",
    "L": "#2a1800",
    "l": "#160400",
    "O": "#000000"
  },
  "frames": {
    "idle": [
      "....................",
      "....................",
      "....................",
      "....................",
      "............OOOOO...",
      "...........OFFFFFO..",
      "..........OFFFFFFFO.",
      ".........OFFFFFFFFFO",
      ".........OFFFFFYXYFO",
      ".........OFBBBBYXYFO",
      ".........OBBBBBBFFFO",
      "........ObBBBBBBBFO.",
      "........ObBBBBBBBO..",
      ".......ObbBBBBBBBO..",
      "..OOOOOObbBBBBBBBO..",
      ".OKKKKKbbbBBBBBBO...",
      ".OKKKKKbbbBBBBBBO...",
      ".OKKKKKbbbBBBBBO....",
      ".OKKKKKbbbBBBBBO....",
      ".OKKKKKbbbBBBBO.....",
      "..OObbbbbbBBBBO.....",
      "...ObbbbbbBBBO......",
      "..ObbbbbbbBBO.......",
      "..ObbbbbbbBBLO......",
      ".ObbbbbbbbBLLO......",
      ".ObbbbbbbbBLLO......",
      ".ObbbbbbbbLLLLO.....",
      ".ObbbbbbbbLLLLO.....",
      "..ObbbbbbllLLLLO...."
    ],
    "run_a": [
      "....................",
      "....................",
      "....................",
      "....................",
      "............OOOOO...",
      "...........OFFFFFO..",
      "..........OFFFFFFFO.",
      ".........OFFFFFFFFFO",
      ".........OFFFFFYXYFO",
      ".........OFBBBBYXYFO",
      ".........OBBBBBBFFFO",
      "........ObBBBBBBBFO.",
      "........ObBBBBBBBO..",
      ".......ObbBBBBBBBO..",
      "..OOOOOObbBBBBBBBO..",
      ".OKKKKKbbbBBBBBBO...",
      ".OKKKKKbbbBBBBBBO...",
      ".OKKKKKbbbBBBBBO....",
      ".OKKKKKbbbBBBBBO....",
      ".OKKKKKbbbBBBBO.....",
      "..OObbbbbbBBBBO.....",
      "...ObbbbbbBBBO......",
      "..ObbbbbbbBBO.......",
      "..ObbbbbbbBBLO......",
      ".ObbbbbbbbBLLO......",
      ".ObbbbbbbbBLLO......",
      ".ObbbbbbbbLLLLO.....",
      "OlbbbbbbbbLLLLO.....",
      "OllbbbbbbOOLLLLO...."
    ],
    "run_b": [
      "....................",
      "....................",
      "....................",
      "....................",
      "............OOOOO...",
      "...........OFFFFFO..",
      "..........OFFFFFFFO.",
      ".........OFFFFFFFFFO",
      ".........OFFFFFYXYFO",
      ".........OFBBBBYXYFO",
      ".........OBBBBBBFFFO",
      "........ObBBBBBBBFO.",
      "........ObBBBBBBBO..",
      ".......ObbBBBBBBBO..",
      "..OOOOOObbBBBBBBBO..",
      ".OKKKKKbbbBBBBBBO...",
      ".OKKKKKbbbBBBBBBO...",
      ".OKKKKKbbbBBBBBO....",
      ".OKKKKKbbbBBBBBO....",
      ".OKKKKKbbbBBBBO.....",
      "..OObbbbbbBBBBO.....",
      "...ObbbbbbBBBO......",
      "..ObbbbbbbBBO.......",
      "..ObbbbbbbBBLO......",
      ".ObbbbbbbbBLLO......",
      ".ObbbbbbbbBLO.......",
      ".ObbbbbbbbLLO.......",
      ".ObbbbbbbbLLO.......",
      "..ObbbbbbllO........"
    ],
    "jump": [
      "....................",
      "....................",
      "....................",
      "....................",
      "............OOOOO...",
      "...........OFFFFFO..",
      "..........OFFFFFFFO.",
      ".........OFFFFFFFFFO",
      ".........OFFFFFYXYFO",
      ".........OFBBBBYXYFO",
      ".........OBBBBBBFFFO",
      "........ObBBBBBBBFO.",
      "........ObBBBBBBBO..",
      ".......ObbBBBBBBBO..",
      "..OOOOOObbBBBBBBBO..",
      ".OKKKKKbbbBBBBBBO...",
      ".OKKKKKbbbBBBBBBO...",
      ".OKKKKKbbbBBBBBO....",
      ".OKKKKKbbbBBBBBO....",
      ".OKKKKKbbbBBBBO.....",
      "..OObbbbbbBBBBO.....",
      "...ObbbbbbBBBO......",
      "..ObbbbbbbBBO.......",
      "..ObbbbbbbBBO.......",
      ".ObbbbbbbbBLLO......",
      ".ObbbbbbbbBLLO......",
      ".ObbbbbbbbLLO.......",
      ".ObbbbbbbbOO........",
      "..ObbbbbbO.........."
    ]
  }
}
