{
  "$schema": "../../../schemas/sprite.schema.json",
  "id": "player_gladiator",
  "w": 20,
  "h": 30,
  "palette": {
    "H": "#774411",
    "P": "#cc2200",
    "B": "#884422",
    "b": "#6a2604",
    "M": "#cc9933",
    "S": "#663300",
    "L": "#554433",
    "l": "#3c2b1a",
    "O": "#000000"
  },
  "frames": {
    "idle": [
      "..............OOO...",
      ".............OPPPO..",
      ".............OPPPO..",
      ".............OPPPO..",
      "............OOPPPO..",
      "...........OHHPPPO..",
      "..........OHHHHHHHO.",
      "..........OHHHHHHHO.",
      ".........OHHHHHHHHHO",
      ".........OHHHHHHHHHO",
      "..........OHBBHHHHO.",
      ".........OBBBBBBHHO.",
      "........ObBBBBBBHO..",
      ".OOOOOO.ObBBBBBBBO..",
      "OSSSSSSObbBBBBBBBO..",
      "OSSSSSSObbBBBBBBO...",
      "OSSSSSSbbbBBBBBBO...",
      "OSSSSSSMMMMMMMMO....",
      "OSSSSSSMMMMMMMMO....",
      "OSSSSSSbbbBBBBO.....",
      "OSSSSSSMMMMMMMMO....",
      "OSSSSSSMMMMMMMMO....",
      ".OObbbbbbbBBOOO.....",
      "..ObbbbbbbBLO.......",
      ".ObbbbbbbbBLLO......",
      ".ObbbbbbbbLLLO......",
      "..ObbbbbbbLLLO......",
      "..ObbbbbblLLLLO.....",
      "...OObblllLLLLO.....",
      ".....OOllllLLLLO...."
    ],
    "run_a": [
      "..............OOO...",
      ".............OPPPO..",
      ".............OPPPO..",
      ".............OPPPO..",
      "............OOPPPO..",
      "...........OHHPPPO..",
      "..........OHHHHHHHO.",
      "..........OHHHHHHHO.",
      ".........OHHHHHHHHHO",
      ".........OHHHHHHHHHO",
      "..........OHBBHHHHO.",
      ".........OBBBBBBHHO.",
      "........ObBBBBBBHO..",
      ".OOOOOO.ObBBBBBBBO..",
      "OSSSSSSObbBBBBBBBO..",
      "OSSSSSSObbBBBBBBO...",
      "OSSSSSSbbbBBBBBBO...",
      "OSSSSSSMMMMMMMMO....",
      "OSSSSSSMMMMMMMMO....",
      "OSSSSSSbbbBBBBO.....",
      "OSSSSSSMMMMMMMMO....",
      "OSSSSSSMMMMMMMMO....",
      ".OObbbbbbbBBOOO.....",
      "..ObbbbbbbBLO.......",
      ".ObbbbbbbbBLLO......",
      ".ObbbbbbbbLLLO......",
      "..ObbbbbbbLLLO......",
      ".OObbbbbbOLLLLO.....",
      "OllllbblOOLLLLO.....",
      "OllllllO..OLLLLO...."
    ],
    "run_b": [
      "..............OOO...",
      ".............OPPPO..",
      ".............OPPPO..",
      ".............OPPPO..",
      "............OOPPPO..",
      "...........OHHPPPO..",
      "..........OHHHHHHHO.",
      "..........OHHHHHHHO.",
      ".........OHHHHHHHHHO",
      ".........OHHHHHHHHHO",
      "..........OHBBHHHHO.",
      ".........OBBBBBBHHO.",
      "........ObBBBBBBHO..",
      ".OOOOOO.ObBBBBBBBO..",
      "OSSSSSSObbBBBBBBBO..",
      "OSSSSSSObbBBBBBBO...",
      "OSSSSSSbbbBBBBBBO...",
      "OSSSSSSMMMMMMMMO....",
      "OSSSSSSMMMMMMMMO....",
      "OSSSSSSbbbBBBBO.....",
      "OSSSSSSMMMMMMMMO....",
      "OSSSSSSMMMMMMMMO....",
      ".OObbbbbbbBBOOO.....",
      "..ObbbbbbbBLO.......",
      ".ObbbbbbbbBLLO......",
      ".ObbbbbbbbLLLO......",
      "..ObbbbbbbLLO.......",
      "..ObbbbbblLLO.......",
      "...OObblllLLO.......",
      "....OLLllllO........"
    ],
    "jump": [
      "..............OOO...",
      ".............OPPPO..",
      ".............OPPPO..",
      ".............OPPPO..",
      "............OOPPPO..",
      "...........OHHPPPO..",
      "..........OHHHHHHHO.",
      "..........OHHHHHHHO.",
      ".........OHHHHHHHHHO",
      ".........OHHHHHHHHHO",
      "..........OHBBHHHHO.",
      ".........OBBBBBBHHO.",
      "........ObBBBBBBHO..",
      ".OOOOOO.ObBBBBBBBO..",
      "OSSSSSSObbBBBBBBBO..",
      "OSSSSSSObbBBBBBBO...",
      "OSSSSSSbbbBBBBBBO...",
      "OSSSSSSMMMMMMMMO....",
      "OSSSSSSMMMMMMMMO....",
      "OSSSSSSbbbBBBBO.....",
      "OSSSSSSMMMMMMMMO....",
      "OSSSSSSMMMMMMMMO....",
      ".OObbbbbbbBBOOO.....",
      "..ObbbbbbbBO........",
      ".ObbbbbbbbBLO.......",
      ".ObbbbbbbbLLLO......",
      "..ObbbbbbbLLLO......",
      "..ObbbbbbOLLO.......",
      "...OObbOO.OO........",
      ".....OO............."
    ]
  }
}
