{
  "$schema": "../../../schemas/sprite.schema.json",
  "id": "battle_orc",
  "w": 34,
  "h": 34,
  "palette": {
    "O": "#0e1409",
    "G": "#4e6b46",
    "g": "#688a5c",
    "D": "#35492f",
    "R": "#e8b23c",
    "r": "#fff0a8",
    "W": "#f4efe0",
    "B": "#5a3f28",
    "b": "#7a5738",
    "M": "#c8ccd8",
    "m": "#8e94a6",
    "K": "#6b4a2a"
  },
  "frames": {
    "idle": [
      "........OOOOOOOOOOOOOO............",
      "......OOgggggggggggggOO...........",
      ".....OGgggggggggggggggGO..........",
      "....OGGgggggggggggggggGGO.........",
      "....OGGgggggggggggggggGGO....OO...",
      "....OGGgOORRggggRROOgggGO...OMMO..",
      "....OGGgOrRRRggRRRrOgggGO...OMMO..",
      "....OGGgORRRRggRRRROgggGO..OMMMMO.",
      "....OGGggOORRggRROOggggGO..OMMMMO.",
      "....OGGgggggggggggggggGGO..OMmmMO.",
      "....OGGGgggggggggggggGGGO..OMmmMO.",
      ".....OGWgggggggggggWgGGO...OOMMOO.",
      ".....OGWWgggggggggWWgGGO....OKKO..",
      "......OGGgWWWWWWWWgggGO.....OKKO..",
      ".......OGGGgggggggGGGO......OKKO..",
      "..OOOOOOGGGGGGGGGGGGGOOOOOOOOKKO..",
      ".OGgggGOGGGDDGGGGDDGGOGgggGGOKKO..",
      "OGgggggOGGDDDGGGGDDDGOGgggggOKKO..",
      "OGgggggOGDDDDGGGGDDDDGOgggggOKKO..",
      "OGgggggOGGDDDGGGGDDDGOGgggggOKKO..",
      ".OGgggGOGGGDDGGGGDDGGOGgggGGOKKO..",
      "..OOGGOOGGGGGGGGGGGGGOOGGGOO.OO...",
      "...OGGO.OGGGGGGGGGGGO.OGGGO.......",
      "...OGGO.OGGGGGGGGGGGO.OGGGO.......",
      "....OO..OBBBBBBBBBBBO..OOOO.......",
      "........OBbbBBBBBbbBO.............",
      "........OBBBBBBBBBBBO.............",
      "........OBBBOOOOOBBBO.............",
      ".......OGGGGO...OGGGGO............",
      ".......OGGGGO...OGGGGO............",
      "......OKKKKKO...OKKKKKO...........",
      "......OKKKKKO...OKKKKKO...........",
      ".....OKKKKKKKO.OKKKKKKKO..........",
      ".....OOOOOOOOO.OOOOOOOOO.........."
    ],
    "attack": [
      "..................OOOOOOOO........",
      "..............OOOOMMMMMMMMOOO.....",
      "........OOOOOOOMMMMMMMMMMMMMO.....",
      "......OOgggggggOMMMMMMMMMMMMO.....",
      ".....OGgggggggggOMMMMMMMMMMO......",
      "....OGGgggggggggOOMMMMMMMOO.......",
      "....OGGgORRRRggRRRROOKKKOO........",
      "....OGGgORRRRggRRRRGOKKKO.........",
      "....OGGgOORRggggRROOgOKKKO........",
      "....OGGggggggggggggggGOKKKO.......",
      "....OGGGgggggggggggggGGOKKKO......",
      ".....OGWWWWWWWWWWWWWgGGOKKKO......",
      ".....OGWOWOWOWOWOWOWgGGOKKKO......",
      "......OGWWWWWWWWWWWWggGOKKKO......",
      ".......OGGGgggggggGGGOOOKKKO......",
      "..OOOOOOGGGGGGGGGGGGGOOOOKKKO.....",
      ".OGgggGOGGGDDGGGGDDGGOGgOOOOO.....",
      "OGgggggOGGDDDGGGGDDDGOGggggO......",
      "OGgggggOGDDDDGGGGDDDDGOgggggO.....",
      "OGgggggOGGDDDGGGGDDDGOGgggggO.....",
      ".OGgggGOGGGDDGGGGDDGGOGgggGGO.....",
      "..OOGGOOGGGGGGGGGGGGGOOGGGOO......",
      "...OGGO.OGGGGGGGGGGGO.OGGGO.......",
      "...OOO..OGGGGGGGGGGGO.OOOO........",
      "........OBBBBBBBBBBBO.............",
      "........OBbbBBBBBbbBO.............",
      "........OBBBBBBBBBBBO.............",
      ".......OOBBBOOOOOBBBOO............",
      "......OGGGGO.....OGGGGO...........",
      ".....OGGGGO.......OGGGGO..........",
      ".....OKKKKO........OKKKKO.........",
      "....OKKKKKO........OKKKKKO........",
      "....OKKKKKKO......OKKKKKKO........",
      "....OOOOOOOO......OOOOOOOO........"
    ]
  }
}
