{
  "$schema": "../../../schemas/sprite.schema.json",
  "id": "player_survival",
  "w": 20,
  "h": 29,
  "palette": {
    "F": "#c4945a",
    "H": "#2a4a18",
    "E": "#1a1a1a",
    "B": "#3a5228",
    "b": "#172f05",
    "P": "#2a3c1a",
    "L": "#2a3c1a",
    "l": "#071900",
    "O": "#0a0a12"
  },
  "frames": {
    "idle": [
      "....................",
      "....................",
      "....................",
      "....................",
      "..........OOOOOOOOOO",
      ".........OHHHHHHHHHH",
      ".........OHHHHHHHHHH",
      ".........OHHHHHHHHHH",
      "........OHHHHHHHEHHH",
      "........OHHHBBHHEHHH",
      ".........OBBBBBBFFFO",
      ".........OBBBBBBFFO.",
      "...OOOOOObBBBBBBBO..",
      "..OPPPPPPbBBBBBBBO..",
      "..OPPPPPPbBBBBBBO...",
      "..OPPPPPPbBBBBBBO...",
      "..OPPPPPPbBBBBBO....",
      "..OPPPPPPbBBBBO.....",
      "..OPPPPPPbBBBBO.....",
      "..OPPPPPPbBBBO......",
      "..OPPPPPPbBBO.......",
      "..OPPPPPPbBBO.......",
      "..ObbbbbbbBLO.......",
      ".ObbbbbbbbBLLO......",
      ".ObbbbbbbbLLLO......",
      "..ObbbbbbOLLLO......",
      "..ObbbbbblLLLLO.....",
      "...OObblllLLLLO.....",
      ".....OOllllLLLLO...."
    ],
    "run_a": [
      "....................",
      "....................",
      "....................",
      "....................",
      "..........OOOOOOOOOO",
      ".........OHHHHHHHHHH",
      ".........OHHHHHHHHHH",
      ".........OHHHHHHHHHH",
      "........OHHHHHHHEHHH",
      "........OHHHBBHHEHHH",
      ".........OBBBBBBFFFO",
      ".........OBBBBBBFFO.",
      "...OOOOOObBBBBBBBO..",
      "..OPPPPPPbBBBBBBBO..",
      "..OPPPPPPbBBBBBBO...",
      "..OPPPPPPbBBBBBBO...",
      "..OPPPPPPbBBBBBO....",
      "..OPPPPPPbBBBBO.....",
      "..OPPPPPPbBBBBO.....",
      "..OPPPPPPbBBBO......",
      "..OPPPPPPbBBO.......",
      "..OPPPPPPbBBO.......",
      "..ObbbbbbbBLO.......",
      ".ObbbbbbbbBLLO......",
      ".ObbbbbbbbLLLO......",
      "..ObbbbbbOLLLO......",
      ".OObbbbbbOLLLLO.....",
      "OllllbblOOLLLLO.....",
      "OllllllO..OLLLLO...."
    ],
    "run_b": [
      "....................",
      "....................",
      "....................",
      "....................",
      "..........OOOOOOOOOO",
      ".........OHHHHHHHHHH",
      ".........OHHHHHHHHHH",
      ".........OHHHHHHHHHH",
      "........OHHHHHHHEHHH",
      "........OHHHBBHHEHHH",
      ".........OBBBBBBFFFO",
      ".........OBBBBBBFFO.",
      "...OOOOOObBBBBBBBO..",
      "..OPPPPPPbBBBBBBBO..",
      "..OPPPPPPbBBBBBBO...",
      "..OPPPPPPbBBBBBBO...",
      "..OPPPPPPbBBBBBO....",
      "..OPPPPPPbBBBBO.....",
      "..OPPPPPPbBBBBO.....",
      "..OPPPPPPbBBBO......",
      "..OPPPPPPbBBO.......",
      "..OPPPPPPbBBO.......",
      "..ObbbbbbbBLO.......",
      ".ObbbbbbbbBLLO......",
      ".ObbbbbbbbLLLO......",
      "..ObbbbbbLLLO.......",
      "..ObbbbbblLLO.......",
      "...OObblllLLO.......",
      "....OLLllllO........"
    ],
    "jump": [
      "....................",
      "....................",
      "....................",
      "....................",
      "..........OOOOOOOOOO",
      ".........OHHHHHHHHHH",
      ".........OHHHHHHHHHH",
      ".........OHHHHHHHHHH",
      "........OHHHHHHHEHHH",
      "........OHHHBBHHEHHH",
      ".........OBBBBBBFFFO",
      ".........OBBBBBBFFO.",
      "...OOOOOObBBBBBBBO..",
      "..OPPPPPPbBBBBBBBO..",
      "..OPPPPPPbBBBBBBO...",
      "..OPPPPPPbBBBBBBO...",
      "..OPPPPPPbBBBBBO....",
      "..OPPPPPPbBBBBO.....",
      "..OPPPPPPbBBBBO.....",
      "..OPPPPPPbBBBO......",
      "..OPPPPPPbBBO.......",
      "..OPPPPPPbBBO.......",
      "..ObbbbbbbBO........",
      ".ObbbbbbbbBLO.......",
      ".ObbbbbbbbLLLO......",
      "..ObbbbbbLLLLO......",
      "..ObbbbbbOLLO.......",
      "...OObbOO.OO........",
      ".....OO............."
    ]
  }
}
