{
  "$schema": "../../../schemas/sprite.schema.json",
  "id": "battle_cultist_zealot",
  "w": 32,
  "h": 34,
  "palette": {
    "O": "#0c0a12",
    "R": "#7e2323",
    "r": "#a33a3a",
    "q": "#2a1010",
    "D": "#1a0808",
    "E": "#ffd34d",
    "e": "#fff4b8",
    "P": "#e8e2d0",
    "p": "#b8ae9a",
    "M": "#a06ad0",
    "m": "#d7aef5"
  },
  "frames": {
    "idle": [
      "............OOOOOO..............",
      "..........OOrrrrrrOO............",
      ".........OrrrrrrrrrrO...........",
      "........OrrrrrrrrrrrrO..........",
      ".......OrrrRRRRRRRRrrrO.........",
      ".......OrrRDDDDDDDDRrrrO........",
      "......OrrRDDDDDDDDDDRrrrO.......",
      "......OrRDDDDDDDDDDDDRrrO.......",
      "......OrRDDEEDDDDEEDDRrrO.......",
      "......OrRDeEEeDDeEEeDRrrO.......",
      "......OrRDDEEDDDDEEDDRrrO.......",
      "......OrRDDDDDDDDDDDDRrrO.......",
      "......OrrRDDDDDDDDDDRrrrO.......",
      ".......OrrRRDDDDDDRRrrrO........",
      ".......OrrrrRRRRRRrrrrO.........",
      "......OrrrrrrrrrrrrrrrrO........",
      ".....OrrrrrrrrrrrrrrrrrrO.......",
      "....ORrrrrrrrrrrrrrrrrrrRO......",
      "...ORRRrrrrrrrrrrrrrrrrRRRO.....",
      "..ORRRRRrrrrrrrrrrrrrrRRRRRO....",
      "..ORRRRRRrrrrrrrrrrrrRRRRRRO....",
      "..ORRRRRRRrrrrrrrrrrRRRRRRRO....",
      ".ORRRPPPPRRrrrrrrrrRRPPPPRRRO...",
      ".ORRPPPPPPRRrrrrrrRRPPPPPPRRO...",
      ".ORRPPPPPPRRRqqqqRRRPPPPPPRRO...",
      ".ORRRPPPPRRRqqqqqqRRRPPPPRRRO...",
      "ORRRRRRRRRRRqqqqqqRRRRRRRRRRRO..",
      "ORRRRRRRRRRRqqqqqqRRRRRRRRRRRO..",
      "ORRRRRRRRRRRRqqqqRRRRRRRRRRRRO..",
      "ORRRRRRRRRRRRRRRRRRRRRRRRRRRRO..",
      "OqRRRRRRRRRRRRRRRRRRRRRRRRRRqO..",
      "OqqRRRRRRRRRRRRRRRRRRRRRRRRqqO..",
      ".OqqqqqqqqqqqqqqqqqqqqqqqqqqO...",
      "..OOOOOOOOOOOOOOOOOOOOOOOOOO...."
    ],
    "attack": [
      "..MM........OOOOOO..........MM..",
      ".MmmM.....OOrrrrrrOO.......MmmM.",
      "..MM.....OrrrrrrrrrrO.......MM..",
      "........OrrrrrrrrrrrrO..........",
      ".......OrrrRRRRRRRRrrrO.........",
      "..M....OrrRDDDDDDDDRrrrO....M...",
      ".MmM..OrrRDDDDDDDDDDRrrrO..MmM..",
      ".MmM..OrRDDDDDDDDDDDDRrrO..MmM..",
      ".MmM..OrRDEEEEDDEEEEDRrrO..MmM..",
      "..M...OrRDeEEEeDeEEEeRrrO...M...",
      "......OrRDEEEEDDEEEEDRrrO.......",
      "......OrRDDDDDDDDDDDDRrrO.......",
      "......OrrRDDDDDDDDDDRrrrO.......",
      ".......OrrRRDDDDDDRRrrrO........",
      "......OOrrrrRRRRRRrrrrOO........",
      ".....OrrrrrrrrrrrrrrrrrrO.......",
      "....ORrrrrrrrrrrrrrrrrrrRO......",
      "...ORRRrrrrrrrrrrrrrrrrRRRO.....",
      "..ORRRRRrrrrrrrrrrrrrrRRRRRO....",
      ".ORRPPPPPRrrrrrrrrrrRPPPPPRRO...",
      "ORRPPPPPPPRrrrrrrrrRPPPPPPPRRO..",
      "ORRPPPPPPPRRrrrrrrRRPPPPPPPRRO..",
      "ORRRPPPPPRRRMMMMMMRRRPPPPPRRRO..",
      ".ORRRRRRRRRMMmmmmMMRRRRRRRRRO...",
      ".ORRRRRRRRRMmMMMMmMRRRRRRRRRO...",
      "ORRRRRRRRRRMMmmmmMMRRRRRRRRRRO..",
      "ORRRRRRRRRRRMMMMMMRRRRRRRRRRRO..",
      "ORRRRRRRRRRRRMMMMRRRRRRRRRRRRO..",
      "ORRRRRRRRRRRRRRRRRRRRRRRRRRRRO..",
      "OqRRRRRRRRRRRRRRRRRRRRRRRRRRqO..",
      "OqqRRRRRRRRRRRRRRRRRRRRRRRRqqO..",
      "OqqqRRRRRRRRRRRRRRRRRRRRRRqqqO..",
      ".OqqqqqqqqqqqqqqqqqqqqqqqqqqO...",
      "..OOOOOOOOOOOOOOOOOOOOOOOOOO...."
    ]
  }
}
