{
  "$schema": "../../../schemas/sprite.schema.json",
  "id": "battle_goblin_chief",
  "w": 32,
  "h": 32,
  "palette": {
    "O": "#111a0c",
    "G": "#8a7423",
    "g": "#d4bb4a",
    "D": "#5c4a10",
    "R": "#e8562f",
    "r": "#ffb03a",
    "W": "#f2ecd6",
    "B": "#4a3b28",
    "b": "#63512f",
    "K": "#7a5a33",
    "k": "#a07a44"
  },
  "frames": {
    "idle": [
      "..O..........................O..",
      ".OgO........................OgO.",
      ".OGgO......................OGgO.",
      ".OGGgO....OOOOOOOOOO......OGgGO.",
      ".OGGGgOOOOgggggggggggOOOOOGgGGO.",
      "..OGGGGgggggggggggggggggggGGGO..",
      "...OGGGGgggggggggggggggggGGGO...",
      "....OGGGgggggggggggggggggGGO....",
      ".....OGGggggggggggggggggGGO.....",
      ".....OGGggOORRggggRROOggGGO.....",
      ".....OGGgOrRRRgggRRRrOggGGO.....",
      ".....OGGgORRRRgggRRRROggGGO.....",
      ".....OGGggOORRggggRROOggGGO.....",
      ".....OGGgggggggggggggggGGGO.....",
      ".....OGGGgggggOOOgggggGGGGO.....",
      "......OGGgggOWWWWWOgggGGGO......",
      "......OGGGgOWOWOWOWOgGGGO.......",
      ".......OGGGOWWWWWWWOGGGO........",
      "........OGGGOOOOOOOGGGO.........",
      ".........OGGGGGGGGGGGO..........",
      "......OOOOGGGGGGGGGGGOOOO.......",
      "....OOkkkOGGDDGGGGDDGOkkkOO.....",
      "...OkkKKkOGDDDGGGGDDDGOkKKkO....",
      "...OkKKKkOGGDDGGGGDDGGOkKKKO....",
      "....OKKKOOGGGGGGGGGGGGOOKKKO....",
      ".....OOOO.OGGGGGGGGGGO..OOOO....",
      "..........OBBBBBBBBBBO..........",
      "..........OBbbBBBBbbBO..........",
      "..........OBBBOOOBBBBO..........",
      ".........OGGGO...OGGGGO.........",
      ".........OGGGO...OGGGGO.........",
      ".........OOOOO...OOOOOO........."
    ],
    "attack": [
      "..O.......OOOOOOOO..........O...",
      ".OgO.....OKkkkkkkKO........OgO..",
      ".OGgO....OKkKKKKkKO.......OGgO..",
      ".OGGgO...OKkkkkkkKO......OGgGO..",
      ".OGGGgO..OOKKKKKKOO.....OGgGGO..",
      "..OGGGGgO.OKKKKKKO....OGGGGGO...",
      "...OGGGGggOKKKKKKOggggGGGGGO....",
      "....OGGGgggOKKKKOgggggggGGO.....",
      ".....OGGgggOKKKKOgggggggGGO.....",
      ".....OGGgOORRggOOgRROOggGGO.....",
      ".....OGGgOrRRRgggRRRrOggGGO.....",
      ".....OGGgORRRRgggRRRROggGGO.....",
      ".....OGGgOORRggggRROOggGGO......",
      ".....OGGggggggggggggggGGGO......",
      ".....OGGGgggOOOOOOOgggGGGO......",
      "......OGGggOWWWWWWWOggGGO.......",
      "......OGGGOWOWOWOWOWOGGGO.......",
      ".......OGGOWOWOWOWOWOGGO........",
      "........OGGOWWWWWWWOGGO.........",
      ".........OGGGOOOOOGGGO..........",
      "......OOOOGGGGGGGGGGGOOOO.......",
      "...OOkkkOOGGDDGGGGDDGOOkkkOO....",
      "..OkkKKkOOGDDDGGGGDDDGOOkKKkO...",
      "..OkKKKkO.OGDDGGGGDDGO.OkKKKO...",
      "...OKKKO..OGGGGGGGGGGO..OKKKO...",
      "....OOO...OGGGGGGGGGGO...OOO....",
      "..........OBBBBBBBBBBO..........",
      "..........OBbbBBBBbbBO..........",
      ".........OOBBBOOOBBBBOO.........",
      "........OGGGGO...OGGGGGO........",
      ".......OGGGGO.....OGGGGGO.......",
      ".......OOOOO.......OOOOOO......."
    ]
  }
}
