{
  "$schema": "../../../schemas/sprite.schema.json",
  "id": "battle_heroine",
  "w": 32,
  "h": 40,
  "palette": {
    "O": "#17121e",
    "H": "#6b452e",
    "h": "#8f6440",
    "D": "#452c1d",
    "R": "#c8455a",
    "F": "#f0e4d0",
    "S": "#f4cfa8",
    "C": "#3f5ea6",
    "c": "#5d80cc",
    "d": "#2a3f75",
    "B": "#28345e",
    "b": "#3c4c80",
    "K": "#3b2b21",
    "M": "#e2e7f3",
    "G": "#c9a23e",
    "W": "#ffffff"
  },
  "frames": {
    "idle": [
      ".............OOOO...............",
      "..........OOOhhhhhhOOO..........",
      "........OOhhhhhhhhhhhhOO........",
      ".......OhhhhhhhhhhhhhhhhO.......",
      "......OhhhHHHHHHHHHHHHhhO.......",
      "......OhHHHHHHHHHHHHHHHHO.......",
      "......OHHHHHHHDDDDHHHHHHHO......",
      "......OHHHHHHDDDDDDHHHHHHO......",
      "......OHHHHHHHDDDDHHHHHHHO......",
      "......ODHHHHHHHDDHHHHHHHDO......",
      ".....ORRODHHHHHHHHHHHHDOORRO....",
      ".....ORRRODDHHHHHHHHDDORRRO.....",
      "......ORRODDDHHHHHHDDDORRO......",
      "....OOOOOFFFDDHHHHDDFFFOOOOO....",
      "...OFFFFFFFFFDDHHDDFFFFFFFFFO...",
      "...OSSFCCCCCCCDHHDCCCCCCCFSSO.GG",
      "..OSSSFCCCCCCCDHHDCCCCCCCFSSSOGG",
      "..OSSSFCcCCCCCDHHDCCCCCcCFSSSOMM",
      "..OSSSFCcCCCCCDHHDCCCCCcCFSSSOMM",
      "..OSSSFCCCCCCCDHHDCCCCCCCFSSSOMM",
      "...OSSFCCCCCCCDHHDCCCCCCCFSSOOMM",
      "....OOFCCCCCCCDHHDCCCCCCCFOO.MM.",
      ".....OCCCCCCCCDHHDCCCCCCCCO..MM.",
      ".....OCCCCCCCCDHHDCCCCCCCCO..MM.",
      ".....OCCCCCCCCCDDCCCCCCCCCO..MM.",
      ".....OCCCCCCCCCCCCCCCCCCCCO..MM.",
      ".....OccCCCCCCCCCCCCCCCCccO..MM.",
      ".....OccCCCCCCCCCCCCCCCCccO..MM.",
      "....OBBBBBBBBBBBBBBBBBBBBBBO.MM.",
      "....OBbbBBBBBBBBBBBBBBBBbbBO..O.",
      "....OBBBBBBBBBBBBBBBBBBBBBBO....",
      "....OBBBBBBBBBBBBBBBBBBBBBBO....",
      "......OOOSSSOOOOOOOSSSOOO.......",
      ".........OSSSO....OSSSO.........",
      ".........OSSSO....OSSSO.........",
      ".........OKKKO....OKKKO.........",
      ".........OKKKO....OKKKO.........",
      "........OKKKKO....OKKKKO........",
      ".......OKKKKKKO..OKKKKKKO.......",
      ".......OOOOOOOO..OOOOOOOO......."
    ],
    "attack": [
      "...W........OOOO................",
      "..WM.....OOOhhhhhhOOO...........",
      ".WMM...OOhhhhhhhhhhhhOO.........",
      "WMM...OhhhhhhhhhhhhhhhhO........",
      "MM...OhhhHHHHHHHHHHHHhhO........",
      "MM..OhHHHHHHHHHHHHHHHHO.........",
      "MM.OHHHHHHHDDDDHHHHHHHO.........",
      "GG.OHHHHHHDDDDDDHHHHHHO.........",
      "GGOHHHHHHHDDDDHHHHHHHO..........",
      "OSODHHHHHHHDDHHHHHHHDO..........",
      "OSSORRODHHHHHHHHHHDOORRO........",
      "OSSSORRRODDHHHHHHDDORRRO........",
      ".OSSSSORRODDDHHHHDDDORRO........",
      "..OOOOOOFFFDDHHHHDDFFFOOOO......",
      "..OFFFFFFFFFDDHHDDFFFFFFFFO.....",
      ".OSSFCCCCCCCCDHHDCCCCCCCCFSSO...",
      "OSSSFCCCCCCCCDHHDCCCCCCCCFSSSO..",
      "OSSSFCcCCCCCCDHHDCCCCCCcCFSSSO..",
      "OSSSFCcCCCCCCDHHDCCCCCCcCFSSSO..",
      "OSSSFCCCCCCCCDHHDCCCCCCCCFSSSO..",
      ".OSSFCCCCCCCCDHHDCCCCCCCCFSSO...",
      "..OOFCCCCCCCCDHHDCCCCCCCCFOO....",
      "...OCCCCCCCCCDHHDCCCCCCCCCO.....",
      "...OCCCCCCCCCDHHDCCCCCCCCCO.....",
      "...OCCCCCCCCCCDDCCCCCCCCCCO.....",
      "...OCCCCCCCCCCCCCCCCCCCCCCO.....",
      "...OccCCCCCCCCCCCCCCCCCCccO.....",
      "...OccCCCCCCCCCCCCCCCCCCccO.....",
      "..OBBBBBBBBBBBBBBBBBBBBBBBBO....",
      "..OBbbBBBBBBBBBBBBBBBBBBbbBO....",
      "..OBBBBBBBBBBBBBBBBBBBBBBBBO....",
      "..OBBBBBBBBBBBBBBBBBBBBBBBBO....",
      "..OOOSSSOOOOOOOOOOOSSSOOOOO.....",
      ".OSSSSO........OSSSSO...........",
      "OSSSSO..........OSSSSO..........",
      "OKKKKO...........OKKKKO.........",
      "OKKKKO............OKKKKO........",
      "OKKKKO.............OKKKKKO......",
      "OKKKKKKO...........OKKKKKKO.....",
      "OOOOOOOO...........OOOOOOOO....."
    ],
    "hurt": [
      "................................",
      "..............OOOO..............",
      "...........OOOhhhhhhOOO.........",
      ".........OOhhhhhhhhhhhhOO.......",
      "........OhhhhhhhhhhhhhhhhO......",
      ".......OhhhHHHHHHHHHHHHhhO......",
      ".......OhHHHHHHHHHHHHHHHHO......",
      ".......OHHHHHHHDDDDHHHHHHHO.....",
      ".......OHHHHHHDDDDDDHHHHHHO.....",
      ".......OHHHHHHHDDDDHHHHHHHO.....",
      ".......ODHHHHHHHDDHHHHHHHDO.....",
      "......ORRODHHHHHHHHHHHHDOORRO...",
      "......ORRRODDHHHHHHHHDDORRRO....",
      ".....OOOOOFFFDDHHHHDDFFFOOOOO...",
      "....OFFFFFFFFFDDHHDDFFFFFFFFFO..",
      "....OSSFCCCCCCCDHHDCCCCCCCFSSO..",
      "...OSSSFCCCCCCCDHHDCCCCCCCFSSSO.",
      "...OSSSFCcCCCCCDHHDCCCCCcCFSSSO.",
      "...OSSSFCcCCCCCDHHDCCCCCcCFSSSO.",
      "...OSSSFCCCCCCCDHHDCCCCCCCFSSSO.",
      "....OSSFCCCCCCCDHHDCCCCCCCFSSO..",
      ".....OOFCCCCCCCDHHDCCCCCCCFOO...",
      "......OCCCCCCCCDHHDCCCCCCCCO....",
      "......OCCCCCCCCDHHDCCCCCCCCO....",
      "......OCCCCCCCCCDDCCCCCCCCCO....",
      "......OCCCCCCCCCCCCCCCCCCCCO....",
      "......OccCCCCCCCCCCCCCCCCccO....",
      "......OccCCCCCCCCCCCCCCCCccO....",
      ".....OBBBBBBBBBBBBBBBBBBBBBBO...",
      ".....OBbbBBBBBBBBBBBBBBBbbBBO...",
      ".....OBBBBBBBBBBBBBBBBBBBBBBO...",
      ".....OBBBBBBBBBBBBBBBBBBBBBBO...",
      ".......OOOSSSOOOOOOOSSSOOO......",
      "..........OSSSO....OSSSO........",
      "..........OSSSO....OSSSO........",
      "..........OKKKO....OKKKO........",
      "..........OKKKO....OKKKO........",
      ".........OKKKKO....OKKKKO.......",
      "........OKKKKKKO..OKKKKKKO......",
      "........OOOOOOOO..OOOOOOOO......"
    ]
  }
}
