{
  "$schema": "../../../schemas/sprite.schema.json",
  "id": "player_platformer",
  "w": 20,
  "h": 29,
  "palette": {
    "F": "#f5c080",
    "C": "#cc2222",
    "E": "#1a1a1a",
    "W": "#ffffff",
    "B": "#cc2222",
    "b": "#a90000",
    "S": "#ffcc00",
    "L": "#2244cc",
    "l": "#0021a9",
    "O": "#000000"
  },
  "frames": {
    "idle": [
      "....................",
      "....................",
      "....................",
      "....................",
      "..........OOOOOOOOOO",
      ".........OCCCCCCCCCC",
      ".........OCCCCCCCCCC",
      ".........OCCCCCCCCCC",
      "........OCCCCCCEWWCC",
      "........OCCCBBCEEECC",
      ".........OBBBBBBFFFO",
      "........ObBBBBBBFFO.",
      "........ObBBBBBBBO..",
      ".......ObbBBBBBBBO..",
      "......OFbbBBBBBBO...",
      ".....OFbbbBBBBBBO...",
      "....OFbbbbBBBBBO....",
      "...OFFbbbbSSBBBO....",
      "..OFFbbbbSSSSBO.....",
      ".OFFbbbbbSSSSO......",
      ".OFFbbbbbSSSBO......",
      "..ObbbbbbbBBO.......",
      "..ObbbbbbbBLO.......",
      ".ObbbbbbbbBLLO......",
      ".ObbbbbbbbLLLO......",
      "..ObbbbbbbLLLO......",
      "..ObbbbbblLLLLO.....",
      "...OObblllLLLLO.....",
      ".....OOllllLLLLO...."
    ],
    "run_a": [
      "....................",
      "....................",
      "....................",
      "....................",
      "..........OOOOOOOOOO",
      ".........OCCCCCCCCCC",
      ".........OCCCCCCCCCC",
      ".........OCCCCCCCCCC",
      "........OCCCCCCEWWCC",
      "........OCCCBBCEEECC",
      ".........OBBBBBBFFFO",
      "........ObBBBBBBFFO.",
      "........ObBBBBBBBO..",
      ".......ObbBBBBBBBO..",
      "......OFbbBBBBBBO...",
      ".....OFbbbBBBBBBO...",
      "....OFbbbbBBBBBO....",
      "...OFFbbbbSSBBBO....",
      "..OFFbbbbSSSSBO.....",
      ".OFFbbbbbSSSSO......",
      ".OFFbbbbbSSSBO......",
      "..ObbbbbbbBBO.......",
      "..ObbbbbbbBLO.......",
      ".ObbbbbbbbBLLO......",
      ".ObbbbbbbbLLLO......",
      "..ObbbbbbbLLLO......",
      ".OObbbbbbOLLLLO.....",
      "OllllbblOOLLLLO.....",
      "OllllllO..OLLLLO...."
    ],
    "run_b": [
      "....................",
      "....................",
      "....................",
      "....................",
      "..........OOOOOOOOOO",
      ".........OCCCCCCCCCC",
      ".........OCCCCCCCCCC",
      ".........OCCCCCCCCCC",
      "........OCCCCCCEWWCC",
      "........OCCCBBCEEECC",
      ".........OBBBBBBFFFO",
      "........ObBBBBBBFFO.",
      "........ObBBBBBBBO..",
      ".......ObbBBBBBBBO..",
      "......OFbbBBBBBBO...",
      ".....OFbbbBBBBBBO...",
      "....OFbbbbBBBBBO....",
      "...OFFbbbbSSBBBO....",
      "..OFFbbbbSSSSBO.....",
      ".OFFbbbbbSSSSO......",
      ".OFFbbbbbSSSBO......",
      "..ObbbbbbbBBO.......",
      "..ObbbbbbbBLO.......",
      ".ObbbbbbbbBLLO......",
      ".ObbbbbbbbLLLO......",
      "..ObbbbbbbLLO.......",
      "..ObbbbbblLLO.......",
      "...OObblllLLO.......",
      "....OLLllllO........"
    ],
    "jump": [
      "....................",
      "....................",
      "....................",
      "....................",
      "..........OOOOOOOOOO",
      ".........OCCCCCCCCCC",
      ".........OCCCCCCCCCC",
      ".........OCCCCCCCCCC",
      "........OCCCCCCEWWCC",
      "........OCCCBBCEEECC",
      ".........OBBBBBBFFFO",
      "........ObBBBBBBFFO.",
      "........ObBBBBBBBO..",
      ".......ObbBBBBBBBO..",
      "......OFbbBBBBBBO...",
      ".....OFbbbBBBBBBO...",
      "....OFbbbbBBBBBO....",
      "...OFFbbbbSSBBBO....",
      "..OFFbbbbSSSSBO.....",
      ".OFFbbbbbSSSSO......",
      ".OFFbbbbbSSSBO......",
      "..ObbbbbbbBBO.......",
      "..ObbbbbbbBO........",
      ".ObbbbbbbbBLO.......",
      ".ObbbbbbbbLLLO......",
      "..ObbbbbbbLLLO......",
      "..ObbbbbbOLLO.......",
      "...OObbOO.OO........",
      ".....OO............."
    ]
  }
}
