{
  "$schema": "../../../schemas/sprite.schema.json",
  "id": "battle_keeper",
  "w": 44,
  "h": 40,
  "palette": {
    "O": "#0a0910",
    "P": "#e6dfc8",
    "p": "#c3b9a0",
    "q": "#9c927a",
    "D": "#3a2c46",
    "d": "#241a2e",
    "R": "#8a2f3f",
    "r": "#b5495a",
    "E": "#ffd34d",
    "e": "#fff3c0",
    "G": "#c9a23e",
    "g": "#efd07a",
    "I": "#f24a4a",
    "i": "#ff9a8a"
  },
  "frames": {
    "idle": [
      "................OOOOOOOOOO..................",
      "..............OOddddddddddOO................",
      "............OOdddddddddddddOO...............",
      "...........OdddddddddddddddddO..............",
      "..........OdddIIIIIIIIIIIIdddO..............",
      "..........OddIIIIIIIIIIIIIIddO..............",
      "..........OdIIIIEEEEEEEEIIIIdO..............",
      "..........OdIIIEEeeeeeeEEIIIdO..............",
      "..........OdIIIEeeOOOOeeEIIIdO..............",
      "..........OdIIIEeeOOOOeeEIIIdO..............",
      "..........OdIIIEEeeeeeeEEIIIdO..............",
      "..........OdIIIIEEEEEEEEIIIIdO..............",
      "..........OddIIIIIIIIIIIIIIddO..............",
      "...........OdddIIIIIIIIIIdddO...............",
      "............OOdddddddddddddOO...............",
      ".......OOOOOOOddddddddddddOOOOOOO...........",
      "....OOOgGGGGGOOPPPPPPPPPPOOgGGGGGgOOO.......",
      "...OgGGGGGGGGOPPPPPPPPPPPPOGGGGGGGGgO.......",
      "..OgGGGGGGGGGOPPPPPPPPPPPPOGGGGGGGGGgO......",
      "..OGGGGGGGGGGOPPqqqqqqqqPPOGGGGGGGGGGO......",
      "..OGGGGGGGGGGOPqRRRRRRRRqPOGGGGGGGGGGO......",
      "..OGGGGGGGGGGOPqRrrrrrrRqPOGGGGGGGGGGO......",
      "..OGGGGGGGGGGOPqRrrrrrrRqPOGGGGGGGGGGO......",
      "..OGGGGGGGGGGOPqRRRRRRRRqPOGGGGGGGGGGO......",
      "..OgGGGGGGGGGOPPqqqqqqqqPPOGGGGGGGGGgO......",
      "...OgGGGGGGGGOPPPPPPPPPPPPOGGGGGGGGgO.......",
      "....OOOOOOOOOOPPPPPPPPPPPPOOOOOOOOOO........",
      "..........OOOPPPPPPPPPPPPPPOOO..............",
      "..........OPPPpppppppppppppPPO..............",
      "..........OPPpqqqqqqqqqqqqqpPO..............",
      "..........OPPPpppppppppppppPPO..............",
      ".........OOPPPPPPPPPPPPPPPPPPOO.............",
      "........OdddddddddddddddddddddO.............",
      "........OdddddddddddddddddddddO.............",
      ".......OddddddddddddddddddddddddO...........",
      "......OdddddOOOOOOOOOOOOddddddddO...........",
      ".....OddddO............OdddddddddO..........",
      "....OddddO..............OddddddddO..........",
      "....OdddO................OdddddddO..........",
      "....OOOO..................OOOOOOOO.........."
    ],
    "attack": [
      "....GG..........OOOOOOOOOO..........GG......",
      "...GggG.......OOddddddddddOO.......GggG.....",
      "....GG......OOdddddddddddddOO.......GG......",
      "...........OdddddddddddddddddO..............",
      "..........OdddIIIIIIIIIIIIdddO..............",
      ".........OddIIIIIIIIIIIIIIIIddO.............",
      ".........OdIIIIEEEEEEEEEEIIIIdO.............",
      ".........OdIIIEEeeeeeeeeEEIIIdO.............",
      ".........OdIIEEeeIIIIIIeeEEIIdO.............",
      ".........OdIIEEeeIIIIIIeeEEIIdO.............",
      ".........OdIIIEEeeeeeeeeEEIIIdO.............",
      ".........OdIIIIEEEEEEEEEEIIIIdO.............",
      "..........OddIIIIIIIIIIIIIIddO..............",
      "...........OdddIIIIIIIIIIdddO...............",
      "............OOdddddddddddddOO...............",
      "....OOOOOOOOOOddddddddddddOOOOOOOOOOO.......",
      "..OOgGGGGGGGGOOPPPPPPPPPPOOgGGGGGGGGgOO.....",
      ".OgGGGGGGGGGGGOPPPPPPPPPPPOGGGGGGGGGGGgO....",
      "OgGGGGGGGGGGGGOPPPPPPPPPPPPOGGGGGGGGGGGgO...",
      "OGGGGGGGGGGGGGOPqRRRRRRRRqPOGGGGGGGGGGGGO...",
      "OGGGGGGGGGGGGGOqRRRRRRRRRRqOGGGGGGGGGGGGO...",
      "OGGGGGGGGGGGGGOqRrrrrrrrrRqOGGGGGGGGGGGGO...",
      "OGGGGGGGGGGGGGOqRrrrrrrrrRqOGGGGGGGGGGGGO...",
      "OGGGGGGGGGGGGGOqRRRRRRRRRRqOGGGGGGGGGGGGO...",
      "OgGGGGGGGGGGGGOPqRRRRRRRRqPOGGGGGGGGGGGgO...",
      ".OgGGGGGGGGGGGOPPPPPPPPPPPPOGGGGGGGGGGgO....",
      "..OOOOOOOOOOOOOPPPPPPPPPPPPOOOOOOOOOOOO.....",
      "..........OOOPPPPPPPPPPPPPPOOO..............",
      "..........OPPPpppppppppppppPPO..............",
      "..........OPPpqqqqqqqqqqqqqpPO..............",
      "..........OPPPpppppppppppppPPO..............",
      ".........OOPPPPPPPPPPPPPPPPPPOO.............",
      "........OdddddddddddddddddddddO.............",
      ".......OddddddddddddddddddddddO.............",
      "......OddddddddddddddddddddddddO............",
      ".....OdddddOOOOOOOOOOOOOOdddddddO...........",
      "....OddddO................OdddddddO.........",
      "...OddddO..................OdddddddO........",
      "...OdddO....................OddddddO........",
      "...OOOO......................OOOOOOO........"
    ]
  }
}
