{
  "$schema": "../../../schemas/sprite.schema.json",
  "id": "battle_night_wraith",
  "w": 34,
  "h": 32,
  "palette": {
    "O": "#090d13",
    "W": "#3a3228",
    "w": "#5a4e3a",
    "v": "#282018",
    "D": "#18140e",
    "d": "#0c0a08",
    "E": "#ffd34d",
    "e": "#fff0b0",
    "C": "#ffe8a0"
  },
  "frames": {
    "idle": [
      "..........OOOOOOOOOO..............",
      "........OOwwwwwwwwwwOO............",
      ".......OwwwwwwwwwwwwwwO...........",
      "......OwwwwwwwwwwwwwwwwO..........",
      "......OwwwDDDDDDDDDDwwwO..........",
      "......OwwDDDDDDDDDDDDwwO..........",
      "......OwDDDDDDDDDDDDDDwO..........",
      "......OwDDEEDDDDDDEEDDwO..........",
      "......OwDDEEDDDDDDEEDDwO..........",
      "......OwDDDDDDDDDDDDDDwO..........",
      "......OwwDDDDDDDDDDDDwwO..........",
      "......OwwwDDDDDDDDDDwwwO..........",
      ".......OwwwwDDDDDDwwwwO...........",
      "....OOOOwwwwwwwwwwwwwOOOO.........",
      "..OOWWWWWWWWWWWWWWWWWWWWWOO.......",
      ".OWWWWWWWWWWWWWWWWWWWWWWWWWO......",
      "OWWWWWWWWWWWWWWWWWWWWWWWWWWWO.....",
      "OWWvvWWWWWWWWWWWWWWWWWWWvvWWO.....",
      "OWvCCvWWWWWWWWWWWWWWWWWvCCvWO.....",
      "OWvCCCvWWWWWWWWWWWWWWWvCCCvWO.....",
      "OWWvCCvWWWWWWWWWWWWWWWWvCCvWO.....",
      ".OWWvvWWWWWWWWWWWWWWWWWWvvWO......",
      ".OWWWWWWWWWWWWWWWWWWWWWWWWWO......",
      "..OWWWWWWWWWWWWWWWWWWWWWWWO.......",
      "...OWWWWWWWWWWWWWWWWWWWWWO........",
      "....OWWWWWWWWWWWWWWWWWWWO.........",
      ".....OvWWWOWWWOWWWOWWWvO..........",
      "......OvWO.OvWO.OvWO.OvO..........",
      ".......OO...OO...OO...O...........",
      "..................................",
      "..................................",
      ".................................."
    ],
    "attack": [
      "..E.......OOOOOOOOOO..........E...",
      ".EeE....OOwwwwwwwwwwOO.......EeE..",
      "..E....OwwwwwwwwwwwwwwO.......E...",
      "......OwwwwwwwwwwwwwwwwO..........",
      "......OwwwDDDDDDDDDDwwwO..........",
      "..E...OwwDDDDDDDDDDDDwwO....E.....",
      ".EeE..OwDDDDDDDDDDDDDDwO...EeE....",
      ".EeE..OwDEEEEEDDEEEEEDwO...EeE....",
      ".EeE..OwDeEEEeDDeEEEeDwO...EeE....",
      "..E...OwDDEEEEDDEEEEDDwO....E.....",
      "......OwwDDDDDDDDDDDDwwO..........",
      "......OwwwDDDDDDDDDDwwwO..........",
      "....OOOOwwwwDDDDDDwwwwOOOO........",
      "..OOWWWWWWWWWWWWWWWWWWWWWWOO......",
      ".OWWWWWWWWWWWWWWWWWWWWWWWWWWO.....",
      "OWWWWWWWWWWWWWWWWWWWWWWWWWWWWO....",
      "OWCCWWWWWWWWWWWWWWWWWWWWWWCCWO....",
      "OCCCCWWWWWWWWWWWWWWWWWWWWCCCCO....",
      "OCCCCCWWWWWWWWWWWWWWWWWWCCCCCO....",
      "OCCCCWWWWWWWWWWWWWWWWWWWWCCCCO....",
      "OWCCWWWWWWWWWWWWWWWWWWWWWWCCWO....",
      ".OWWWWWWWWWWWWWWWWWWWWWWWWWWO.....",
      "..OWWWWWWWWWWWWWWWWWWWWWWWWO......",
      "...OWWWWWWWWWWWWWWWWWWWWWWO.......",
      "....OWWWWWWWWWWWWWWWWWWWWO........",
      ".....OWWWWWWWWWWWWWWWWWWO.........",
      "......OvWWOWWWWOWWWWOWWvO.........",
      ".......OvO.OvWO.OvWO.OvO..........",
      "........O...OO...OO...O...........",
      "..................................",
      "..................................",
      ".................................."
    ]
  }
}
